job_url,site,title,company,company_url,location,job_type,date_posted,interval,min_amount,max_amount,currency,is_remote,num_urgent_words,benefits,emails,description
https://www.indeed.com/viewjob?jk=69d37e63a9e3cafc,indeed,Development Operations Engineer,DEMO,https://www.indeed.com/cmp/Demo,USA,,2023-02-06,,,,,False,0.0,,,"Customer Success Manager USA Loxo is a high growth startup building a machine intelligence SaaS platform that has the potential to become one of the most successful Enterprise SaaS startups of all time. We are a pioneer in the emerging web 3.0 era, and will revolutionize the way that recruiters approach talent acquisition. With a reputation for providing the best customer experience in our industry, our customer success team will be experts not only in Loxo but in the recruiting profession, and will consistently elevate those who source and hire top talent. Your role as a Customer Success Manager Our Customer Success team at Loxo is the face of our company and is responsible for partnering with our valued customers to help them successfully implement our product, increase user adoption, and maintain retention. We are looking for an experienced Customer Success Manager who thrives in a dynamic, fast-paced, and high-performing environment. We're also looking for someone who is empathic and relationship-driven. This position is a unique opportunity to be a critical team member at a high-growth tech start-up. We operate with a team-first ethos and a maniacal focus on customer satisfaction and success. We are entering the most exciting stage of a startup where we transition from building the product to the business building as we become the fastest-growing company in our industry sector. This is a 100% remote position. What you will be doing: Build and manage customer relationships post-sales; onboarding, implementation, and renewals. Mitigate and retain at-risk customers using user data and relationship management. Collaborate cross-functionally with Sales, Product, Marketing, and Engineering to advocate for customer's product and technical needs. Prepare and present Business Reviews for our strategic customer partnerships. Become a subject matter expert in all things recruiting and hiring in order to act as a consultant to improve our customer's processes. Maintain high levels of customer engagement and satisfaction with a focus on customer loyalty. Help drive efficiency across all of the functions that support the growth and success of our customers. What you should have: 5+ years of relevant work experience in customer-facing customer success, account management, or strategic consulting organization. SaaS experience a benefit. A self-motivated, collaborative teammate with creative ideas to inspire customer loyalty, solve problems, and build process. Strong interpersonal skills and experience building strong internal and external relationships. Excellent written and verbal communication skills. Apply"
https://www.indeed.com/viewjob?jk=985121798affd975,indeed,Engineer,DEMO,https://www.indeed.com/cmp/Demo,USA,,2023-02-03,,,,,False,0.0,,,"Customer Success Manager USA Loxo is a high growth startup building a machine intelligence SaaS platform that has the potential to become one of the most successful Enterprise SaaS startups of all time. We are a pioneer in the emerging web 3.0 era, and will revolutionize the way that recruiters approach talent acquisition. With a reputation for providing the best customer experience in our industry, our customer success team will be experts not only in Loxo but in the recruiting profession, and will consistently elevate those who source and hire top talent. Your role as a Customer Success Manager Our Customer Success team at Loxo is the face of our company and is responsible for partnering with our valued customers to help them successfully implement our product, increase user adoption, and maintain retention. We are looking for an experienced Customer Success Manager who thrives in a dynamic, fast-paced, and high-performing environment. We're also looking for someone who is empathic and relationship-driven. This position is a unique opportunity to be a critical team member at a high-growth tech start-up. We operate with a team-first ethos and a maniacal focus on customer satisfaction and success. We are entering the most exciting stage of a startup where we transition from building the product to the business building as we become the fastest-growing company in our industry sector. This is a 100% remote position. What you will be doing: Build and manage customer relationships post-sales; onboarding, implementation, and renewals. Mitigate and retain at-risk customers using user data and relationship management. Collaborate cross-functionally with Sales, Product, Marketing, and Engineering to advocate for customer's product and technical needs. Prepare and present Business Reviews for our strategic customer partnerships. Become a subject matter expert in all things recruiting and hiring in order to act as a consultant to improve our customer's processes. Maintain high levels of customer engagement and satisfaction with a focus on customer loyalty. Help drive efficiency across all of the functions that support the growth and success of our customers. What you should have: 5+ years of relevant work experience in customer-facing customer success, account management, or strategic consulting organization. SaaS experience a benefit. A self-motivated, collaborative teammate with creative ideas to inspire customer loyalty, solve problems, and build process. Strong interpersonal skills and experience building strong internal and external relationships. Excellent written and verbal communication skills. Apply"
https://www.indeed.com/viewjob?jk=697371b3f258903f,indeed,Cloud Engineer,Vitesse Group,,"Remote, USA",fulltime,2022-11-08,yearly,80000.0,85000.0,USD,True,0.0,,resume@vitesse-group.com,"Project Location(s): Remote. Will need to be onsite at client location after COVID-19. Education: Bachelors or higher in Computer Science or Engineering is required Compensation: $80K - 85K per annum Employment Type: Full-Time Interview: 1 Phone Screen interview Number of Positions: 5 Top Candidate Skills/Years of Experience 1. Expertise in Architecting and Implementing Azure Service Offering, such as Azure cloud services, Azure storage, IIS, Azure Active Directory (AD), Azure Resource Manager (ARM), Azure Storage, Azure, Blob Storage, Azure VMs, SQL Database, Azure Functions, Azure Service Fabric, Azure Monitor, and Azure Service Bus. 2. Experience Configure Continuous Integration from source control, setting up build definition within Visual Studio Team Services (VSTS) and configure continuous delivery to automate the deployment of ASP.NET MVC applications to Azure web apps 3. Experience Implementing a CI/CD pipeline with Docker, Jenkins (TFS Plugin installed), Team Foundation Server (TFS), GitHub and Azure Container Service 4. Experience in dealing with Unix/Linux and Windows server administration. PRE-SCREENING QUESTIONS! Have you been involved in large scale distributed project that has online presence? Please summarize your personal work in the above project. How many people were involved with that project? How would you describe your role in the team? Screening Questions must be filled and emailed to us along with resume, Legal Full name and Photo ID to resume@vitesse-group.com."
https://www.indeed.com/viewjob?jk=b8e0135a120b0315,indeed,Development Operations Engineer,SDH Systems,,"Pleasanton, CA, USA",fulltime,2022-11-01,yearly,107494.0,107494.0,USD,False,0.0,,,"Job Duties: Formulates Cloud architectures for business solutions ranging from independent to complex systems by leveraging the following Bluemix Services: Redis, Elasticsearch, Auto-Scaling, etc., Build different environments using Desired State Configuration and repeatable designs. Support both Content and Application deployments in Adobe Enterprise Manager (AEM) in different environments like HINT, HPP-B, HREG, HPP-IDC, HPP-NDC. Design and implementation of Continuous Integration and Continuous Delivery pipelines for Code review, unit test automation, Build & Release automation and Service, Incident and Change Management using BitBucket, APIC, APIM, AEM, Jenkins, Artifactory, Chef, Bluemix. Develop scripts (PowerShell, Python, Ruby, BASH) on windows/Linux systems for automation of the build, release process and automate deployment and release distribution process. Implementing Bluemix application monitoring, alerting, and diagnostics, including Application Insights, Splunk, Dynatrace and dashboards throughout the domain portfolios. Designed and implement Software configuration management (SCM) for creating fully automated continuous integration, continuous delivery, continuous deployment pipelines. Handling of planned maintenance, production outages, and projects across different portfolios. Minimum Qualification: This position requires minimum of Bachelors degree in computer science, computer information systems, information technology, or a combination of education and experience equating to the U.S. equivalent of a Bachelors degree in one of the aforementioned subjects."
https://www.indeed.com/viewjob?jk=fd6142749c1ceeb3,indeed,Development Operations Engineer,Datasync Techonlogies Inc,,"Tysons, VA, USA",fulltime,2021-02-03,,,,,False,0.0,,,"We are in search of a DevOps Engineer who is ready to help us improve our customer experience by building functional systems that bring our business to new heights. You will need to have strong experience in Amazon Web Services, because you will be creating cloud formation templates to build AWS services to support custom Java applications which means you will need to be fluent in Java, too. As a DevOps Engineer, you will also be working in conjunction with other teams to deploy these new products and manage our infrastructure, associated processes and systems. It will definitely help for you to be detail-oriented and a skilled problem solver, because you will also be helping us to streamline our processes and automating them where applicable. DevOps Engineer Responsibilities Build whole stack ELBs to databases, then moving and launching the site, guiding the team through the entire process. Effectively manage and assign projects as necessary while lending support to the team. Building and maintaining tools, solutions and microservices associated with deployment and our operations platform, ensuring that all meet our customer service standards and reduce errors. Actively troubleshoot any issues that arise during testing and production, catching and solving issues before launch. Test our system integrity, implemented designs, application developments and other processes related to infrastructure, making improvements as needed. Deploy product updates as required while implementing integrations when they arise. Automate our operational processes as needed, with accuracy and in compliance with our security requirements. Stay current with industry trends and source new ways for our business to improve. DevOps Engineer Requirements Bachelors Degree or Masters in Computer Science, Engineering, Software Engineering or a relevant field. Strong experience with Linux-based infrastructures, Linux/Unix administration, and AWS. Strong experience with databases such as SQL, MS SQL, MySQL, NoSQL, Hadoop, Elasticsearch, Redis, Cassandra, and/or Mongo. Knowledge of scripting languages such as Java, JavaScript, Perl, Ruby, Python, PHP, Groovy, Bash. Experience with project management and workflow tools such as Agile, Jira, Scrum/SAFe, etc. Experience with open-source technologies and cloud services. Experience in working with Puppet or Chef for automation and configuration. Time and project management skills, with the capability to prioritize and multitask as needed. Stay current with industry trends, IT ops and industry best practices, and able to identify the ones we should implement. ONLY CANDIDATES WITH ACTIVE GOVERNMENT SECURITY CLEARANCES AND APPROPRIATE POLY WILL BE CONSIDERED. MUST BE A U.S. CITIZEN. _______________________ Interested in Joining Our Team? - Check out this YouTube video! Be a part of an award-winning, employee friendly company in Northern VA and have the satisfaction of helping keep America safe. DataSync Technologies, Inc is a veteran owned small business providing consulting excellence and real time solutions for customers with complex information technology needs within Intelligence Community. Our cleared consultants bring real world experience with a common sense approach to their jobs whether they are creating complex analytic dashboards, architecting new cloud technology infrastructures, securing sensitive data or streamlining business processes for efficiency. Equal Employment Opportunity DataSync is an EEO and Affirmative Action Employer of Female/Minorities/Veterans/Individuals with Disabilities. All qualified applicants will receive consideration for employment without regard to race, color, religion, sex, sexual orientation, gender identity, national origin, disability, or status as a protected veteran. Information about Equal Employment Opportunity (EEO) and Employee Polygraph Act (EPPA) provisions in addition to other Federal labor laws can be found at the Department of Labor's Website. DataSync is committed to providing veteran employment opportunities to our service men and women."
https://www.indeed.com/viewjob?jk=62cb75d4511eb008,indeed,Development Operations Engineer,Datasync Techonlogies Inc,,"Herndon, VA, USA",fulltime,2021-02-03,,,,,False,0.0,,,"We are in search of a DevOps Engineer who is ready to help us improve our customer experience by building functional systems that bring our business to new heights. You will need to have strong experience in Amazon Web Services, because you will be creating cloud formation templates to build AWS services to support custom Java applications which means you will need to be fluent in Java, too. As a DevOps Engineer, you will also be working in conjunction with other teams to deploy these new products and manage our infrastructure, associated processes and systems. It will definitely help for you to be detail-oriented and a skilled problem solver, because you will also be helping us to streamline our processes and automating them where applicable. DevOps Engineer Responsibilities Build whole stack ELBs to databases, then moving and launching the site, guiding the team through the entire process. Effectively manage and assign projects as necessary while lending support to the team. Building and maintaining tools, solutions and microservices associated with deployment and our operations platform, ensuring that all meet our customer service standards and reduce errors. Actively troubleshoot any issues that arise during testing and production, catching and solving issues before launch. Test our system integrity, implemented designs, application developments and other processes related to infrastructure, making improvements as needed. Deploy product updates as required while implementing integrations when they arise. Automate our operational processes as needed, with accuracy and in compliance with our security requirements. Stay current with industry trends and source new ways for our business to improve. DevOps Engineer Requirements Bachelors Degree or Masters in Computer Science, Engineering, Software Engineering or a relevant field. Strong experience with Linux-based infrastructures, Linux/Unix administration, and AWS. Strong experience with databases such as SQL, MS SQL, MySQL, NoSQL, Hadoop, Elasticsearch, Redis, Cassandra, and/or Mongo. Knowledge of scripting languages such as Java, JavaScript, Perl, Ruby, Python, PHP, Groovy, Bash. Experience with project management and workflow tools such as Agile, Jira, Scrum/SAFe, etc. Experience with open-source technologies and cloud services. Experience in working with Puppet or Chef for automation and configuration. Time and project management skills, with the capability to prioritize and multitask as needed. Stay current with industry trends, IT ops and industry best practices, and able to identify the ones we should implement. ONLY CANDIDATES WITH ACTIVE GOVERNMENT SECURITY CLEARANCES AND APPROPRIATE POLY WILL BE CONSIDERED. MUST BE A U.S. CITIZEN. _______________________ Interested in Joining Our Team? - Check out this YouTube video! Be a part of an award-winning, employee friendly company in Northern VA and have the satisfaction of helping keep America safe. DataSync Technologies, Inc is a veteran owned small business providing consulting excellence and real time solutions for customers with complex information technology needs within Intelligence Community. Our cleared consultants bring real world experience with a common sense approach to their jobs whether they are creating complex analytic dashboards, architecting new cloud technology infrastructures, securing sensitive data or streamlining business processes for efficiency. Equal Employment Opportunity DataSync is an EEO and Affirmative Action Employer of Female/Minorities/Veterans/Individuals with Disabilities. All qualified applicants will receive consideration for employment without regard to race, color, religion, sex, sexual orientation, gender identity, national origin, disability, or status as a protected veteran. Information about Equal Employment Opportunity (EEO) and Employee Polygraph Act (EPPA) provisions in addition to other Federal labor laws can be found at the Department of Labor's Website. DataSync is committed to providing veteran employment opportunities to our service men and women."
https://www.indeed.com/viewjob?jk=c929edb17ee09a81,indeed,Development Operations Engineer,Datasync Techonlogies Inc,,"Reston, VA, USA",fulltime,2021-02-03,,,,,False,0.0,,,"We are in search of a DevOps Engineer who is ready to help us improve our customer experience by building functional systems that bring our business to new heights. You will need to have strong experience in Amazon Web Services, because you will be creating cloud formation templates to build AWS services to support custom Java applications which means you will need to be fluent in Java, too. As a DevOps Engineer, you will also be working in conjunction with other teams to deploy these new products and manage our infrastructure, associated processes and systems. It will definitely help for you to be detail-oriented and a skilled problem solver, because you will also be helping us to streamline our processes and automating them where applicable. DevOps Engineer Responsibilities Build whole stack ELBs to databases, then moving and launching the site, guiding the team through the entire process. Effectively manage and assign projects as necessary while lending support to the team. Building and maintaining tools, solutions and microservices associated with deployment and our operations platform, ensuring that all meet our customer service standards and reduce errors. Actively troubleshoot any issues that arise during testing and production, catching and solving issues before launch. Test our system integrity, implemented designs, application developments and other processes related to infrastructure, making improvements as needed. Deploy product updates as required while implementing integrations when they arise. Automate our operational processes as needed, with accuracy and in compliance with our security requirements. Stay current with industry trends and source new ways for our business to improve. DevOps Engineer Requirements Bachelors Degree or Masters in Computer Science, Engineering, Software Engineering or a relevant field. Strong experience with Linux-based infrastructures, Linux/Unix administration, and AWS. Strong experience with databases such as SQL, MS SQL, MySQL, NoSQL, Hadoop, Elasticsearch, Redis, Cassandra, and/or Mongo. Knowledge of scripting languages such as Java, JavaScript, Perl, Ruby, Python, PHP, Groovy, Bash. Experience with project management and workflow tools such as Agile, Jira, Scrum/SAFe, etc. Experience with open-source technologies and cloud services. Experience in working with Puppet or Chef for automation and configuration. Time and project management skills, with the capability to prioritize and multitask as needed. Stay current with industry trends, IT ops and industry best practices, and able to identify the ones we should implement. ONLY CANDIDATES WITH ACTIVE GOVERNMENT SECURITY CLEARANCES AND APPROPRIATE POLY WILL BE CONSIDERED. MUST BE A U.S. CITIZEN. _______________________ Interested in Joining Our Team? - Check out this YouTube video! Be a part of an award-winning, employee friendly company in Northern VA and have the satisfaction of helping keep America safe. DataSync Technologies, Inc is a veteran owned small business providing consulting excellence and real time solutions for customers with complex information technology needs within Intelligence Community. Our cleared consultants bring real world experience with a common sense approach to their jobs whether they are creating complex analytic dashboards, architecting new cloud technology infrastructures, securing sensitive data or streamlining business processes for efficiency. Equal Employment Opportunity DataSync is an EEO and Affirmative Action Employer of Female/Minorities/Veterans/Individuals with Disabilities. All qualified applicants will receive consideration for employment without regard to race, color, religion, sex, sexual orientation, gender identity, national origin, disability, or status as a protected veteran. Information about Equal Employment Opportunity (EEO) and Employee Polygraph Act (EPPA) provisions in addition to other Federal labor laws can be found at the Department of Labor's Website. DataSync is committed to providing veteran employment opportunities to our service men and women."
