job_url,site,title,company,company_url,location,job_type,date_posted,interval,min_amount,max_amount,currency,is_remote,num_urgent_words,benefits,emails,description
https://www.ziprecruiter.com/k/l/AAKMyTwsj31sbM9L4gUdwwkrlvdlXrmYYKkzYfd8qcV5DEtaw-v7t3uSKib7j7pAeZXrD3BSIbR6eKM8ubFAIr5AtSCKvmMRxHxKjiiZz1XECMz48-XWwGkKdhQQsQN79u0W3e9BeDyFtBiI89V9XjSXSYaP4f6Awq1UMDsTEwKctxPhjp1d5Eb70Y0cocty4PlKoHDXb3HpfTQ6adkq0-OquoQU9_EHYEO6,zip_recruiter,IT PROGRAMMER,Building Automation Products Inc,,"Gays Mills, WI, USA",,2024-02-12,,,,,,0.0,,,"Description:Candidate is U.S. Citizen or Permanent ResidentPosition is Located in Gays Mills, WIBuilding Automation Products, Inc (BAPI) is a company that promotes work life balance. BAPI is a family owned business with a global presence. Position Summary: The IT Programmer adds value to BAPI and the IT/IS Team by working with managers and IT/IS staff to create detailed programming requirements, develop and administer project plans to completion, program, test, document and deploy software. The IT Programmer is responsible long-term programming maintenance, new development and staying proficient in current programming languages.Benefits:  Relocation reimbursement, full benefits which include Health, dental, vision, PTO, 8 paid holidays, 401k match and 100% vested at 90 days and more.IT Programmer Principle Responsibilities:Programs Business ApplicationsCreates and adopts software requirements in collaboration with end users, managers and IT staff Provides design documentation before the onset of programmingDevelops software using best-practice methods, including development in a test bed environmentCreates and adheres to documented test plansPerforms testing, reports and tracks development issues and modifies code as necessarySchedules versioned releases to maintain and update softwareDeploys software in the production environment, ensuring that it functions as expected,Monitor daily batch processing on a rotational schedule Provides Cross-training and Application SupportCross-trains peers with written documentation of code, schemas, test plans and operation instructionsResolve assigned help desk tickets for application issues Defines, analyzes and resolves programming errors and failures Functions as an IT subject matter expertProvides guidance and expert advice to management or other groups on technical, systems, or process-related topicsResearches and recommends compatible programs and plug-ins to augment in-house softwareAdministers assigned workSets specific goals and plans that prioritize, organize, and facilitate completion of each requested projectEstimates time, costs, resources, or materials needed to perform a work activityMaintains industry knowledge by attending educational workshops or classes; reviewing related publications; establishing networks. Contributes to team effort by accomplishing related results as needed, including special projects and tasks as delegated supervisor.Requirements:IT Programmer Education Requirements (R/Required, P/Preferred):(P) Associate degree, Trade or Technical School(P) Bachelor's Degree Degrees Preferred: Information Technology or related field IT Programmer Training, Skills, Knowledge and ExperienceSpecific Training in this field (R/Required, P/Preferred):(R) Demonstrated proficiency in 1 or more programming language(s) (R) Experience with databases(R) Experience with ERP systemsExperience/Knowledge in this field (R/Required, P/Preferred): (R) 5+ years of experience in similar position(P) Experience in Manufacturing industryGeneral Experiences/Knowledge/Skills: Positive attitude and desire to work as part of a team in fast-paced environmentSelf-motivated with a proven ability to solve complex problemsDemonstrate analytical thought process and excellent communication skills, both written and verbal.Demonstrate a strong attention to detail, focus and a willingness to work toward defined goalsMust be very flexible and supportive of changing requirementsDemonstrated ability to provide excellent customer service for internal and external customerExceptional time management skills with the ability to successfully work on multiple projects simultaneouslyPI236270576"
https://www.ziprecruiter.com/k/l/AAIfvhRlOJeFSQANqTRpOSdJYjT62ZK1RnGz7rvxbm4KI_u6P60tQBTr-yv8XZXku88lYQj9bsLDJdNJ7hneNzPQ2WCZPb0DE7O-_0SpBxLkAs81vILWE1LC_hFgz5_npgw2isRP2OL80QsTDG2nxqgtfMY7Aosz9T1gnem633GyGxN7YIAVSFkeJu136UAAgPMxLhqlCgLJc0VgIHi0EG3dzKuciNnifSvtdg,zip_recruiter,Construction Superintendent – Federal Project,Direct Steel and Construction,,"Harpers Ferry, IA, USA",fulltime,2024-02-12,,,,,,0.0,,,"General Contracting firm actively recruiting experienced Superintendent with capabilities in all aspects of commercial construction, including overseeing field construction for project near Harpers Ferry, Iowa. Prior Federal project experience is strongly desired. This project is new construction with an anticipated duration of 2 years.As a Superintendent for our commercial construction project, you will be responsible for overseeing and coordinating all aspects of the construction process from inception to completion. Your leadership and expertise will be crucial in ensuring that the project is executed efficiently, safely, within budget, and on schedule.Key responsibilities include:Project Execution: Supervise and direct all construction personnel to ensure adherence to the project schedule, budget, quality standards, safety protocols, and relevant regulations.Client Communication: Establish and maintain effective communication with stakeholders, providing project updates, addressing concerns, and managing expectations to foster strong relationships.Contract Administration: Administer contracts with subcontractors, vendors, and suppliers, ensuring all parties comply with agreed-upon terms.Change Management: Evaluate and manage change orders while assessing their impact on the project's scope, timeline, and budget.Risk Management: Identify potential risks and develop mitigation strategies to avoid or minimize project delays, budget overruns, and other challenges.Quality Assurance: Implement rigorous quality control processes to deliver projects that meet or exceed industry standards and client expectations.Health and Safety: Promote and enforce a culture of safety on-site, ensuring compliance with health and safety regulations to protect the well-being of all team members and stakeholders.Project Reporting: Prepare daily reports and present regular progress reports to senior management, highlighting milestones, risks, and project performance metrics. Document work completed through progress photos. Characteristics of our ideal candidate:Prior experience managing federal projects. Understanding of administrative and contractual processes.Proven experience as a Superintendent in the commercial construction industry, overseeing medium to large-scale projects. Safety certifications and pre-engineered metal building construction experience are a plus.Advanced degrees and certifications are a plus. Bachelor's degree in Construction Management, Civil Engineering, or a related field.Strong knowledge of construction processes, FAR, building codes, regulations, and best practicesExceptional leadership, communication, and negotiation skillsExcellent problem-solving skills, with the ability to make informed decisions under pressureAttention to detail and a commitment to delivering projects on time and within budget.Highly organized and able to manage deadlines.Proactive self-starter who excels both independently and collaboratively in a team.Exceptionally detail-oriented with strong quantitative and organizational skillsDemonstrates a sense of ownership and follows through tasks until completionMaintains a positive and enthusiastic attitude towards workCapable of multitasking and successfully managing multiple projects and initiatives simultaneouslyMotivated to enhance operational efficiency and drive continuous improvementWorking knowledge of Microsoft Word, Excel, Outlook, and Project.Ability to travel to project site and work flexible hours as requiredValid driver license required If you are a results-driven, proactive, and adaptable professional seeking a challenging opportunity to lead impactful commercial construction projects, we encourage you to submit your resume."
https://www.ziprecruiter.com/k/l/AAKkyyF2RnTVj2RY6ayX2RC0vUh--QLb1YA2WqhsaQ6F5D1fpoRLuc4p3HUqktGC3hSvIbKVPFWkfjlV1W-w_3aLNGuhA0-LJxQfjRXypVFZ9BTXbEG0_GkWIcKWgB4GG5RiEyB0bgqmRZm-26dxVV-noTyO31ngigkjpArQTEXT4J70Zfp7HHZIwnKs9gwnW_jrpMVMSuf10OfNLtF4d-M,zip_recruiter,"Process Engineer, Advanced Manufacturing - Machining & Compressors","Gateway Recruiting, INC.",,"La Crosse, WI, USA",fulltime,2024-02-12,yearly,110000.0,130000.0,USD,,0.0,,,"Job Summary: This is an (AME) Advanced Manufacturing Engineering opening for a Process Engineer specializing in machining and related inspection processes to be based in La Crosse WI for the commercial HVAC business unit. Typical tasks relate to defining machining process concepts, justifying alternatives, supporting procurement of assets, and implementing steps. This specific role will specialize in milling, turning, and handling of centrifugal compressor and heat exchanger components as part of improvement projects directed towards existing operations in La Crosse and future new product development programs.  Job Responsibilities: Machining process definition inclusive of work holding, cutting tool assemblies, tool paths, and process parameters. Machining process implementation includes purchased equipment acceptance testing, part prove-outs, validation work for process capability and rate, and initial training of operations staff.Machining equipment justification and procurement inclusive of alternative analysis and selection, writing specifications and acceptance criteria, and managing purchase and installation tasks. Contribute to manufacturing strategies for machining sites considering product life cycles, business goals, and available industry technology. Coordinate project tasks for machine support processes like parts washing, material presentation, lifting, tool assembly, and inspection. Identify and incorporate industry trends and technology related to machining, inspection, and supporting equipment to enable competitive, productive, safe, and sustainable processes. Participate as an active contributor within new product introductions or major productivity projects delivering machining processes as part of a larger product offering or existing factory. Contribute to safety, productivity, and sustainability initiatives in support of existing operations and new product introductions. Aid in product design conversations working to highlight manufacturing requirements and fit with existing and planned future operation strategies, design for manufacturing in general, lean considerations as well as environmental, health, safety, and sustainability factors.  Qualifications: Bachelor's Degree in Engineering 5+ years of experience in machining Must have “hands-on” experience with the machines to be able to perform setup tasks, program edits, initial CAM programming, and setups. Interpret CMM or other audit-style inspection processes, as well as advanced process troubleshooting.Experience with turning, milling, or multi-function equipment. Experience with fixture design and conceptualization Experience with material handling design and conceptualization as well as other typical work cell-related operator aids. Strong communication skills directed towards training operations staff and actively participating in process conceptualization discussion, as well as justifying ideas with other organization functions.Experience in leading new products or process redefinition efforts. Proficient knowledge of lean, automation, business systems, quality, and product design as they relate to design for manufacturing principles and improving operator efficiency. Proficient knowledge of validation metrics and systems related to quality, cost, rate, and sustainability.  Powered by JazzHRql1Og29uT6"
https://www.ziprecruiter.com/k/l/AAKjIFc90NmbC7oTVEdbCcKjROMGbx5-Q1qyNKAvLbwVOsyIFGI8BTBFZ51nut9EredHAiEEgYpN6d6hpC3Cq_uuVlIfH-uXWWw-jp1MwB3Xq9918CRiAT5YtpIooDd-ucvbIskqkpNMomkPHVo0LU35vPkbzOq4WjiEmiK7FcldTCbBkMPE50jM6pmXKw_2KDWsBoaI5YodzUn44O4vMwo,zip_recruiter,Product Design Engineer,Axiom Path,,"La Crosse, WI, USA",,2024-02-12,yearly,70000.0,130000.0,USD,,0.0,,,"Job Summary:The Senior Product Design Engineer is a key member of the product development team which works closely with other Engineering teams, such as the Test Lab, Manufacturing and Product Management to create competitive designs for Trane Commercial HVAC equipment. The selected individual must have the technical expertise to support and lead product design projects, product validation testing, drive to root cause for quality & reliability issues, interpret technical agency standards and conduct projects in accordance with standard engineering and stage gate product development process practices.Core Job Responsibilities (others may be added): Meet the needs of internal and external customers, through documenting, understanding and prioritizing customer requirements. Apply technical expertise to solve design problems or to gauge appropriateness of product to various applications. Lead efforts to meet performance, reliability, cost, and schedule objectives. Facilitate design reviews and test plan reviews to ensure a robust and reliable design. Conduct design FMEAs; develop and execute resulting risk mitigation plans. Provide technical support to laboratory technicians, manufacturing engineering, suppliers, technical service, and operations. Support field and factory problem resolution. Conduct Laboratory product testing as required. Some overnight travel (less than 10%).Minimum Qualifications: Bachelors Degree in Mechanical Engineering (or equivalent technical discipline) and at least 7 years of engineering or product design experience is required. Masters Degree in Engineering is a plus.Key Competencies: Proficient understanding of HVAC system functions including refrigeration, heat transfer, airflow, and ventilation. Excellent technical, analytical, and problem-solving skills. Excels at understanding and organizing information necessary to make engineering decisions quickly and efficiently. Ability to execute tasks and deliverables in an environment where several concurrent assignments may be active. Excellent verbal and written communication skills ability to communicate up, down, and across the organization. Ability to work as an effective member of a team. Mentoring others as necessary. Prefer strong background in Geometric Dimensioning and Tolerancing (GD&T). Prefer experience with ASME Boiler & Pressure Vessel Code (BPVC). Prefer Computer Aided Design (CAD) knowledge."
https://www.ziprecruiter.com/k/l/AAKZpEwMsBfc20nVJ4D7MV-pGVBSpSV4fWJRZFLvlwl8CcYKaodi9AMICUcBKYoecNaDmVjZ2mSi_BSd77Iq85q-oP1Vb3LEzplUK-0cXTfYtT1XLMk2h0mH-vXhsAYPuRvSdHxrx1msQRf6Hy36gIctZhwz6PY9MfddLyi3BVy92dcSQprrA4gmXyaGaEoX9F0ASHkedCAMjigTBs8Puw,zip_recruiter,Software Engineer,Trane Technologies,,"La Crosse, WI, USA",,2024-02-12,,,,,,0.0,,,"Core Job Responsibilities (others may be added): • DevOps to strengthen the product unit tests, updating the software installer, managing build process, and monitoring overall software performance ..."
https://www.indeed.com/viewjob?jk=c7b4737409078aaf,indeed,Development Operations Engineer,Intercontinental Exchange,https://www.indeed.com/cmp/Intercontinental-Exchange,"Atlanta, GA, USA",fulltime,2024-01-02,,,,,False,1.0,,,"Job Purpose Intercontinental Exchange, Inc. (ICE) presents an opportunity for a full-time DevOps/Automation Engineer to join our SRE Team, responsible for stability of the Mortgage Technology platform. DevOps promotes a culture of trust and risk-sharing between team members. It encourages teams to continuously experiment with the aim of improving the company's products and services. That way, both development and operations teams are enabled to research new customer needs and develop innovations to address them. You will be working with mature teams of experienced engineers on enterprise-scale systems running on cutting edge technologies. Responsibilities Understand the various mortgage platforms and apply technical knowledge to improve system performance and reliability. Follow organizational practices regarding Incident, Problem, and Change Management. Ownership of production incidents including communication, escalation, resolution, and follow-up for root-cause analysis. Ability to be organized and decisive while under pressure, when managing urgent and critical production incidents as and when they occur. Assist other ICE staff with problem solving and escalation procedures. Work with the client support to communicate important information about system maintenance, changes, events, and to address client concerns regarding any aspect of the services. Prepare documentation for troubleshooting and escalation procedures. Create, manage, maintain Operational tools used in Platform Management. Develop and maintain disaster-recovery runbooks and procedures. Scheduling flexibility required. Knowledge and Experience Bachelor s degree in computer science or related field. Excellent communication skills. Working knowledge of Windows, Linux and/or AWS. Working knowledge of database technologies such as SQL Server, T-SQL scripting Experience writing software in at least one high-level programming language such as Python, Java, PowerShell or Perl Working knowledge of internetworking and various LAN/WAN technologies Working knowledge of router, switch, firewall, and proxy technologies Understanding and working knowledge of TCP/IP, UDP and Multicast technologies Team Player - able to interface/liaison effectively with a variety of technical/non-technical contributors throughout the organization. Logical approach, critical thinking and analytical problem-solving skills with the ability to identify the root cause(s) of a problem. Demonstrate reliability, flexibility, and attention to detail. Preferred Skills Meaningful experience with the following technologies is a PLUS: Network troubleshooting and network forensic analysis (packet capture analysis) Understanding of Linux and/or Windows administration and internals Python, Java, JavaScript, PHP, Perl, Bash, Shell, Node.js, SQL Scripting Basic knowledge of Java or .Net coding/debugging. Ability to look at logs/stack trace to debug issues. Experience with enterprise monitoring solutions and APM Experience with configuration as code and infrastructure as code tools like Terraform, Chef, Puppet, CDK, Pulumi Working knowledge of: Akamai (CDN), DNS, LDAP, Splunk, XML, Jenkins, PagerDuty, Rundeck, Git, Tidal Schedule This role offers work from home flexibility of up to 2 days per week. Intercontinental Exchange, Inc. is an Equal Opportunity and Affirmative Action Employer. All qualified applicants will receive consideration for employment without regard to race, color, religion, gender, sexual orientation, gender identity, national origin or ancestry, age, disability or veteran status, or other protected status."
https://www.indeed.com/viewjob?jk=c7b4737409078aaf,indeed,Development Operations Engineer,Intercontinental Exchange,https://www.indeed.com/cmp/Intercontinental-Exchange,"Atlanta, GA, USA",fulltime,2024-01-02,,,,,False,1.0,,,"Job Purpose Intercontinental Exchange, Inc. (ICE) presents an opportunity for a full-time DevOps/Automation Engineer to join our SRE Team, responsible for stability of the Mortgage Technology platform. DevOps promotes a culture of trust and risk-sharing between team members. It encourages teams to continuously experiment with the aim of improving the company's products and services. That way, both development and operations teams are enabled to research new customer needs and develop innovations to address them. You will be working with mature teams of experienced engineers on enterprise-scale systems running on cutting edge technologies. Responsibilities Understand the various mortgage platforms and apply technical knowledge to improve system performance and reliability. Follow organizational practices regarding Incident, Problem, and Change Management. Ownership of production incidents including communication, escalation, resolution, and follow-up for root-cause analysis. Ability to be organized and decisive while under pressure, when managing urgent and critical production incidents as and when they occur. Assist other ICE staff with problem solving and escalation procedures. Work with the client support to communicate important information about system maintenance, changes, events, and to address client concerns regarding any aspect of the services. Prepare documentation for troubleshooting and escalation procedures. Create, manage, maintain Operational tools used in Platform Management. Develop and maintain disaster-recovery runbooks and procedures. Scheduling flexibility required. Knowledge and Experience Bachelor s degree in computer science or related field. Excellent communication skills. Working knowledge of Windows, Linux and/or AWS. Working knowledge of database technologies such as SQL Server, T-SQL scripting Experience writing software in at least one high-level programming language such as Python, Java, PowerShell or Perl Working knowledge of internetworking and various LAN/WAN technologies Working knowledge of router, switch, firewall, and proxy technologies Understanding and working knowledge of TCP/IP, UDP and Multicast technologies Team Player - able to interface/liaison effectively with a variety of technical/non-technical contributors throughout the organization. Logical approach, critical thinking and analytical problem-solving skills with the ability to identify the root cause(s) of a problem. Demonstrate reliability, flexibility, and attention to detail. Preferred Skills Meaningful experience with the following technologies is a PLUS: Network troubleshooting and network forensic analysis (packet capture analysis) Understanding of Linux and/or Windows administration and internals Python, Java, JavaScript, PHP, Perl, Bash, Shell, Node.js, SQL Scripting Basic knowledge of Java or .Net coding/debugging. Ability to look at logs/stack trace to debug issues. Experience with enterprise monitoring solutions and APM Experience with configuration as code and infrastructure as code tools like Terraform, Chef, Puppet, CDK, Pulumi Working knowledge of: Akamai (CDN), DNS, LDAP, Splunk, XML, Jenkins, PagerDuty, Rundeck, Git, Tidal Schedule This role offers work from home flexibility of up to 2 days per week. Intercontinental Exchange, Inc. is an Equal Opportunity and Affirmative Action Employer. All qualified applicants will receive consideration for employment without regard to race, color, religion, gender, sexual orientation, gender identity, national origin or ancestry, age, disability or veteran status, or other protected status."
https://www.linkedin.com/jobs/view/3817514350,linkedin,Site Reliability Engineer DevOps,PEX,https://www.linkedin.com/company/pex-card,"New York, NY",,2024-01-30,,,,,,,,,
https://www.linkedin.com/jobs/view/3719361343,linkedin,Site Reliability Engineer,Evertz,https://ca.linkedin.com/company/evertz,,,2023-08-19,,,,,,,,,
https://www.linkedin.com/jobs/view/3757512267,linkedin,AWS Devops Engineer- US,Zortech Solutions,https://ca.linkedin.com/company/zortech,"Santa Barbara, CA",,2023-11-06,,,,,,,,,
https://www.linkedin.com/jobs/view/3818958535,linkedin,DevOps Engineer,The Select Group,https://www.linkedin.com/company/the-select-group,"St Louis, MO",,2024-01-31,,,,,,,,,
https://www.linkedin.com/jobs/view/3808304215,linkedin,Cloud DevOps Engineer 2,Indev,https://www.linkedin.com/company/indev-llc,,,2024-01-24,,,,,,,,,
https://www.linkedin.com/jobs/view/3809218994,linkedin,AWS Cloud Engineer,ASCENDING Inc.,https://www.linkedin.com/company/ascendingllc,"Fairfax, VA",,2023-12-23,,,,,,,,,
https://www.linkedin.com/jobs/view/3821368639,linkedin,DevOps Engineer,Tree Top Staffing LLC,https://www.linkedin.com/company/tree-top-staffing-llc,"Austin, TX",,2024-02-03,,,,,,,,,
https://www.linkedin.com/jobs/view/3790965724,linkedin,DevOps Engineer Part Time,Burq,https://www.linkedin.com/company/burq,,,2023-12-20,,,,,,,,,
https://www.linkedin.com/jobs/view/3797991591,linkedin,Cloud Engineer/Cloud OPS,"Certec, Inc.",https://www.linkedin.com/company/certec-inc,"Sunnyvale, CA",,2023-12-09,,,,,,,,,
https://www.linkedin.com/jobs/view/3575801988,linkedin,DevOps Engineer,Evident,https://www.linkedin.com/company/evident-id-inc.,"Atlanta, GA",,2023-03-29,,,,,,,,,
