job_url,site,title,company,company_url,location,job_type,date_posted,interval,min_amount,max_amount,currency,is_remote,num_urgent_words,benefits,emails,description
https://www.indeed.com/viewjob?jk=c7b4737409078aaf,indeed,Development Operations Engineer,Intercontinental Exchange,https://www.indeed.com/cmp/Intercontinental-Exchange,"Atlanta, GA, USA",fulltime,2024-01-02,,,,,False,1.0,,,"Job Purpose Intercontinental Exchange, Inc. (ICE) presents an opportunity for a full-time DevOps/Automation Engineer to join our SRE Team, responsible for stability of the Mortgage Technology platform. DevOps promotes a culture of trust and risk-sharing between team members. It encourages teams to continuously experiment with the aim of improving the company's products and services. That way, both development and operations teams are enabled to research new customer needs and develop innovations to address them. You will be working with mature teams of experienced engineers on enterprise-scale systems running on cutting edge technologies. Responsibilities Understand the various mortgage platforms and apply technical knowledge to improve system performance and reliability. Follow organizational practices regarding Incident, Problem, and Change Management. Ownership of production incidents including communication, escalation, resolution, and follow-up for root-cause analysis. Ability to be organized and decisive while under pressure, when managing urgent and critical production incidents as and when they occur. Assist other ICE staff with problem solving and escalation procedures. Work with the client support to communicate important information about system maintenance, changes, events, and to address client concerns regarding any aspect of the services. Prepare documentation for troubleshooting and escalation procedures. Create, manage, maintain Operational tools used in Platform Management. Develop and maintain disaster-recovery runbooks and procedures. Scheduling flexibility required. Knowledge and Experience Bachelor s degree in computer science or related field. Excellent communication skills. Working knowledge of Windows, Linux and/or AWS. Working knowledge of database technologies such as SQL Server, T-SQL scripting Experience writing software in at least one high-level programming language such as Python, Java, PowerShell or Perl Working knowledge of internetworking and various LAN/WAN technologies Working knowledge of router, switch, firewall, and proxy technologies Understanding and working knowledge of TCP/IP, UDP and Multicast technologies Team Player - able to interface/liaison effectively with a variety of technical/non-technical contributors throughout the organization. Logical approach, critical thinking and analytical problem-solving skills with the ability to identify the root cause(s) of a problem. Demonstrate reliability, flexibility, and attention to detail. Preferred Skills Meaningful experience with the following technologies is a PLUS: Network troubleshooting and network forensic analysis (packet capture analysis) Understanding of Linux and/or Windows administration and internals Python, Java, JavaScript, PHP, Perl, Bash, Shell, Node.js, SQL Scripting Basic knowledge of Java or .Net coding/debugging. Ability to look at logs/stack trace to debug issues. Experience with enterprise monitoring solutions and APM Experience with configuration as code and infrastructure as code tools like Terraform, Chef, Puppet, CDK, Pulumi Working knowledge of: Akamai (CDN), DNS, LDAP, Splunk, XML, Jenkins, PagerDuty, Rundeck, Git, Tidal Schedule This role offers work from home flexibility of up to 2 days per week. Intercontinental Exchange, Inc. is an Equal Opportunity and Affirmative Action Employer. All qualified applicants will receive consideration for employment without regard to race, color, religion, gender, sexual orientation, gender identity, national origin or ancestry, age, disability or veteran status, or other protected status."
https://www.indeed.com/viewjob?jk=c7b4737409078aaf,indeed,Development Operations Engineer,Intercontinental Exchange,https://www.indeed.com/cmp/Intercontinental-Exchange,"Atlanta, GA, USA",fulltime,2024-01-02,,,,,False,1.0,,,"Job Purpose Intercontinental Exchange, Inc. (ICE) presents an opportunity for a full-time DevOps/Automation Engineer to join our SRE Team, responsible for stability of the Mortgage Technology platform. DevOps promotes a culture of trust and risk-sharing between team members. It encourages teams to continuously experiment with the aim of improving the company's products and services. That way, both development and operations teams are enabled to research new customer needs and develop innovations to address them. You will be working with mature teams of experienced engineers on enterprise-scale systems running on cutting edge technologies. Responsibilities Understand the various mortgage platforms and apply technical knowledge to improve system performance and reliability. Follow organizational practices regarding Incident, Problem, and Change Management. Ownership of production incidents including communication, escalation, resolution, and follow-up for root-cause analysis. Ability to be organized and decisive while under pressure, when managing urgent and critical production incidents as and when they occur. Assist other ICE staff with problem solving and escalation procedures. Work with the client support to communicate important information about system maintenance, changes, events, and to address client concerns regarding any aspect of the services. Prepare documentation for troubleshooting and escalation procedures. Create, manage, maintain Operational tools used in Platform Management. Develop and maintain disaster-recovery runbooks and procedures. Scheduling flexibility required. Knowledge and Experience Bachelor s degree in computer science or related field. Excellent communication skills. Working knowledge of Windows, Linux and/or AWS. Working knowledge of database technologies such as SQL Server, T-SQL scripting Experience writing software in at least one high-level programming language such as Python, Java, PowerShell or Perl Working knowledge of internetworking and various LAN/WAN technologies Working knowledge of router, switch, firewall, and proxy technologies Understanding and working knowledge of TCP/IP, UDP and Multicast technologies Team Player - able to interface/liaison effectively with a variety of technical/non-technical contributors throughout the organization. Logical approach, critical thinking and analytical problem-solving skills with the ability to identify the root cause(s) of a problem. Demonstrate reliability, flexibility, and attention to detail. Preferred Skills Meaningful experience with the following technologies is a PLUS: Network troubleshooting and network forensic analysis (packet capture analysis) Understanding of Linux and/or Windows administration and internals Python, Java, JavaScript, PHP, Perl, Bash, Shell, Node.js, SQL Scripting Basic knowledge of Java or .Net coding/debugging. Ability to look at logs/stack trace to debug issues. Experience with enterprise monitoring solutions and APM Experience with configuration as code and infrastructure as code tools like Terraform, Chef, Puppet, CDK, Pulumi Working knowledge of: Akamai (CDN), DNS, LDAP, Splunk, XML, Jenkins, PagerDuty, Rundeck, Git, Tidal Schedule This role offers work from home flexibility of up to 2 days per week. Intercontinental Exchange, Inc. is an Equal Opportunity and Affirmative Action Employer. All qualified applicants will receive consideration for employment without regard to race, color, religion, gender, sexual orientation, gender identity, national origin or ancestry, age, disability or veteran status, or other protected status."
https://www.ziprecruiter.com/k/l/AAK6nTQbS50L_HdCJRFulLnpDfThVXesNUXpZBRKGe5igBB1cwyGMbcqpmNI9TwDYcMYFjfrc27lQqeYiGYjtp-_l7bRBGJGKRkdAg1paUU69KBbcIjJvEtlBNrr9CILiQdik8lQyru5btz7qV80BQkwJwF9ZSEgIwU2INVpRGkU9celVHBzfzEr-DfVxbMrAj5H17OD62DEOvV6tNIAEbAGUopkUSFqAsNS,zip_recruiter,Electrical Engineer II,Entegee,,"La Crosse, WI, USA",,2024-02-12,hourly,30.0,40.0,USD,,0.0,,,"Summary: Seeking an Electrical Engineer II for design, development, testing and supervision of electrical equipment manufacturing and installation.Requirements:Bachelor degree in engineering2 to 4 years experience in a related fieldAbility to make sketches, engineering drawings and common computationsAbility to perform detailed calculations to compute and establish manufacturing, construction and installation standards and specificationsUnderstanding of the principles of electrical theory applied to engineering projectsPrevious experience with computer applications and design software related to the engineering fieldPreferred Skills:Controls experience with PLC, Human Machine Interface, and Embedded SoftwareResponsibilities:Design, develop, test or supervise the manufacturing and installation of electrical equipment, components or systemsFocus on machinery controls and wiringEvaluate the cost-effectiveness, reliability and safety of certain design modelsSimulate and test machine/structure/system operationInvestigate and test vendors' products as well as those from competitors.    Pay Details: $30.00 to $40.00 per hour Benefit offerings available for our associates include medical, dental, vision, life insurance, short-term disability, additional voluntary benefits, EAP program, commuter benefits and a 401K plan. Our benefit offerings provide employees the flexibility to choose the type of coverage that meets their individual needs. In addition, our associates may be eligible for paid leave including Paid Sick Leave or any other paid leave required by Federal, State, or local law, as well as Holiday pay where applicable. Equal Opportunity Employer/Veterans/DisabledTo read our Candidate Privacy Information Statement, which explains how we will use your information, please navigate to https://www.entegee.com/candidate-privacy-information-statement/The Company will consider qualified applicants with arrest and conviction records subject to federal contractor requirements and/or security clearance requirements."
https://www.ziprecruiter.com/k/l/AAKDiggvMcRqH_pNn13pBsk5voA9vDPP1TsU6KL9ZIWaI56oaZsSkMhX8yrEvRYylXE84rnRtpmirzgrZW1DlzyMvCgdPriPF_AYLOcwo1ZHqz5y6l41NclS0y-6CXcDYo9NZDiO1GpHRr-sQhS6Ro2-o7Dw0_s1Ozy2F_Bxp92y0beIASUKlHnZu-26BxGC6IH1HVWmg6K5E-yqiXvcjsGme4VRDzWG1tUV,zip_recruiter,Controls Engineer,"Automated Systems, Inc.",,"La Crosse, WI, USA",contract,2024-02-12,hourly,68.0,90.0,USD,,0.0,,,"Controls EngineerContract: 6+ month contract with potential for extensionLocation: La Crosse, WI ON-SITE*Sponsorship is not available for this role now or in the future The Control Engineer is a pivotal piece of our team, using their technical expertise to ensure the facility’s equipment runs efficiently. The Control Engineer will collaborate with our maintenance team and operators to ensure proper preventative and predictive maintenance for our automated packaging equipment. Specifically, this individual will use their knowledge of PLCs and HMI to troubleshoot industrial controls and mechanical repairs. Since our facilities run multiple shifts 7 days a week, this individual will be part of a flexible work schedule to support a variety of shifts and weekend coverage as needed.Duties and Responsibilities· Designs and programs all aspects of PLC/HMI software for packaging equipment across the facility· Tests and debugs control system· Leads and mentors’ front-line technicians; communicates regularly with machine operators· Creates, updates, and modifies machine, part, or facilities schematics using a CAD program· Both AC and DC Drive experience with various drive platforms· Troubleshoots electrical, mechanical, pneumatic, and hydraulic systems· Designs and drafts electrical schematics using AutoCAD Electrical· Troubleshoots process control systems· Performs all duties within GMP standards and is responsible for department compliance with GMP, HACCP, and FSMA guidelines· Performs all functions as required within the CMMS· Writes and modifies extensive PLC and HMI programs for the following: - Allen Bradley, Modicon, Comark, Omron· Troubleshoots or establishes control networks using the following: - EtherNet / IP, DeviceNet, DH-485, Modbus, Modbus PlusRequirementsMinimum Qualifications· Associates or Bachelor’s Degree in Electrical Engineering or 5+ years’ experience in PLC controls engineering in lieu of a degree· High proficiency with Allen Bradley PLC and motion controls· High proficiency using EtherNet/IP or DeviceNet· Experience with high-speed bottling (1000+/minute) very important· Experience in a CPG manufacturing environment, high speed packaging, a plus· Experience with root cause analysis and continuous improvement· Proficiency with AC and DC Drives· Proficiency with RS Logix 500 and 5000; ProWorks NXT; and Wonderwave· Excellent communication, planning, and multi-tasking skills· Proven experience successfully leading teams· Advanced knowledge of electrical systems, control power and drives, sanitary control principles, operation, and troubleshooting· System process controls and line balancing experience· Comfortable working in a manufacturing environment, regularly utilizing power and hand tools, and occasionally lifting up to 25 lbs."
https://www.ziprecruiter.com/k/l/AAIsiBpJ0aSsr-4A6nkxYptk0rTVe55V8KHzZfNyOtdMtvmSi9Ky4mmQJ8PiJADpMfyuSTsj_BMRSHxaW4b9eCoaZKneqOxb7MfYFULzmbte8fklS5cSheRAhcns4ZJFGjh9S3Ztj-3fsxi0EbVQaDi0Rxj81UJzTn9BSHpximcuPS6lz_TBl_QLKGTaiRG7RTyhMtV1_60j0SuR6IGBD-3g15wFI9GFAWaN,zip_recruiter,Metallurgical Engineer (several openings),RightWorks,,"La Crosse, WI, USA",fulltime,2024-02-12,,,,,,0.0,,,"The Manufacturing Engineer Manager is critical to delivering our products on time and of the highest quality to our customers. This role provides key leadership in implementing Lean manufacturing principles, and engineering resources needed to maintain manufacturing equipment in order to achieve safety, quality and production goals. This role has oversight of facilities maintenance and weld engineering. This is an onsite position located in Theodore, Alabama. What Your Day-to-Day Activities Will Be…· Assist in development, justification, planning, and execution of the annual capital equipment budget.· Provide leadership with research, cost analysis, and justification for new product lines, methods, procedures, equipment, and materials.· Evaluate production capacity capabilities of existing operations and implement enhancements.· Participate in quality improvement initiatives ranging from RCCA to six sigma process improvement projects.· Provide leadership for production efficiency improvement initiatives plant wide.· Participate in research and review of sourcing options (and vertical integration alternatives) for key components.· Provide leadership in implementing Lean concepts throughout the plant including 5S, Visual Work, Kanban, etc.· Seek ways to deepen the company’s understanding of vacuum technology, welding, and cryogenic insulation.· Provide and maintain a cost-effective spare parts inventory for production equipment and facilities.· Establish & maintain an effective maintenance management system with a network accessible electronic WO system.· Oversee maintenance shop and spare parts inventory area in accordance with the 6’s philosophy.· Other duties and responsibilities as assigned by management.Your Education Should Be…· Bachelor’s degree in engineering, preferably mechanical, manufacturing, or industrial.· Minimum of 5 years of supervisory / management experience.· Minimum of 5 years of experience in a metalworking or manufacturing environment.· Ability to train/certify in Hazardous Waste.· Ability to train/certify in Hazmat Labels and Manifests.Your Physical Work Environment Will Require…· This position will require the ability to move around the production floor and investigate issues with the production equipment.· Lift up to 15 pounds.· Sitting, standing, stooping, bending, other related tasks in an office setting, as well as spending time walking the shop floor and interacting directly with multiple production personnel on a daily basis.Your Professional Experience Should Be…· Minimum five years supervisory and/or management experience.· Minimum of five years manufacturing experience in a manufacturing facility.· Previous successful leadership experience leading Engineering or technical people.· Must possess a working knowledge of personal computers, including MS Word, Excel, Autocad."
https://www.ziprecruiter.com/k/l/AALRAfcSwxpPcGafyZMee-C4WR5DBf5mt-fRpDZGGRtDC8Ia3mSkQnqZdfs3mvfifVGw3HUYrNgEJa1_FpyORzJJYP7uLHf3s_mDmbwVb5yVRx_4vLBgvnkKxiKxu3_U6VihwZuDwQ8WCz_klJVKO-u4LKy6yX-221Dpezm5kAgEjjgM5Un-6zu2UqH9rULUEfYRMLAfXagJdaOV0OhaztHL_dZhYRQ9YoAH,zip_recruiter,MANUFACTURING ENGINEER,Building Automation Products Inc,,"Gays Mills, WI, USA",,2024-02-12,,,,,,0.0,,,"Description:Candidate is U.S. Citizen or Permanent ResidentPosition is Located in Gays Mills, WIBuilding Automation Products, Inc (BAPI) is a company that promotes work life balance. BAPI is a family owned business with a global presence. Position Summary: The Manufacturing Engineer adds value to BAPI and the Manufacturing Engineering Team by developing and implementing cost effective manufacturing processes and methods in accordance with product specifications and standards.Benefits: Relocation reimbursement, full benefits which include Health, dental, vision, PTO, 8 paid holidays, 401k match and 100% vested at 90 days and more. Manufacturing Engineer Principle Responsibilities: Improve processes within BAPI to increase efficiency and reduce product cost 1. Improve BAPI's manufacturing productivity and quality.Support data collection and analysis for Root Cause Corrective Actions (RCCAs)Identify and provide cost benefit analysis for equipment acquisitions to increase efficiency and/or qualityParticipate in the Design For Manufacturing (DFM) process from Preliminary Design Review (PDR) to product launch 2. Provide manufacturing decision-making information by:Calculating production costs, through time studies, labor analysis, and equipment operating costsIdentifying, implementing, and estimating Production improvement processesCollecting, analyzing, and preparing process and product reports monthly to report manufacturing trends 3. Develop Work Instructions for BAPI's manufacturing processesPlan and implement production flow for new BAPI products Coordinate Pilot and First Article builds across multiple departmentsEvaluate effects of product design changes by designing & testing manufacturing methods and equipmentImprove manufacturing efficiency by analyzing and planning workflow, space requirements, and equipment layoutSupport Bill of Materials (BOM) development for new productsProactively address BAPI facility maintenance requirements Draft, design, and maintain drawings for layout of production equipment, materials, and workspaces for maximum efficiency, using CAD softwareCoordinate and interface with equipment vendors that are conducting work within the BAPI facilityMaintains industry knowledge by attending educational workshops or classes; reviewing related publications; establishing networks. Contributes to team effort by accomplishing related results as needed, including special projects and tasks as delegated supervisor.Requirements:Manufacturing Engineer Education Requirements (R/Required, P/Preferred):(R) Bachelor's Degree(P) Master's DegreeDegrees Preferred: Industrial or Manufacturing Engineer Manufacturing Engineer Training, Skills, Knowledge and ExperienceSpecific Training in this field (R/Required, P/Preferred):(R) Training/experience in electrical/electronics (2+ Years)(R) Training/experience in mechanical engineering (2+ Years)(P) CAD Software (Solidworks)(P) Training/ Experience in Lean Manufacturing systems.Experience/Knowledge in this field (R/required, P/Preferred):(R) Experience working in an electrical/electronics manufacturing facility (2+ Years)(R) Mechanical Experience in a manufacturing facility (2+ Years)(P) Experience in soldering small electronic parts((P) HVAC/R operationsGeneral Experiences/Knowledge/Skills:Monitor own work for qualityInitiative to do the right thing and raise questions as necessaryLeadership skills to oversee/interact professionally with a small team to complete a common goalPositive attitude, cooperation, and willingness to take direction and work with a diverse group of peopleExceptional communication skills, demonstrated ability to communicate respectfully, culturally competent and collaborativelyExcellent Ability to communicate in verbal, written and electronic forms in a professional manner when working with employees, vendors and company contactsPI236091552"
https://www.ziprecruiter.com/ek/l/AAIHlydB-YLf1azCIMsFz4tvRS5wlaw5-6oMiVMsKF6O9ykfKTJipnIYPhvJ3ar0iFD-zD0F870RbQJkI7KS0NSeoL3pcYD7DnMF-iXgEv5J-9anpSQE55BkOXq6DdO8UnNjLCnHlqmovC4MgZjjUcDyG_-ooefv8ATQEM-IerUpSxECgAzZwNnSj9yS3oGSyzJ5nJLeTSYyn7S50jM0u2-i9aXu1Jn4MHrM,zip_recruiter,Senior Compressor Design Engineer,Trane Technologies,,"La Crosse, WI, USA",,2024-02-12,yearly,92000.0,122000.0,USD,,0.0,,,"Collaborate with product engineering, manufacturing engineering, and operations. Assure compatibility between design and process capabilities. Qualifications: * Bachelor's Degree in Mechanical ..."
https://www.ziprecruiter.com/k/l/AALJOsJm6b70LouBjVFZlyLFzo5fxLotaXd_94KKC0UskCBiaT5DKCAed54GQsIkxuUQrDClhR5KlgfQU0rqKrT2rt9D-CgduPWFk_7Iuj8I6FKs0s4zN_mjwiyU5RDbzCEvcoHP2p-VCG5g9q9CGLion0XXOizlSaz9HXMlmsTu4O1liFKAVt-FwN3jBSELNCZRMiJG2iwPxD4xhU_Eo5zq1icNOCwRWclP,zip_recruiter,IT PROGRAMMER,Building Automation Products Inc,,"Gays Mills, WI, USA",,2024-02-12,,,,,,0.0,,,"Description:Candidate is U.S. Citizen or Permanent ResidentPosition is Located in Gays Mills, WIBuilding Automation Products, Inc (BAPI) is a company that promotes work life balance. BAPI is a family owned business with a global presence. Position Summary: The IT Programmer adds value to BAPI and the IT/IS Team by working with managers and IT/IS staff to create detailed programming requirements, develop and administer project plans to completion, program, test, document and deploy software. The IT Programmer is responsible long-term programming maintenance, new development and staying proficient in current programming languages.Benefits:  Relocation reimbursement, full benefits which include Health, dental, vision, PTO, 8 paid holidays, 401k match and 100% vested at 90 days and more.IT Programmer Principle Responsibilities:Programs Business ApplicationsCreates and adopts software requirements in collaboration with end users, managers and IT staff Provides design documentation before the onset of programmingDevelops software using best-practice methods, including development in a test bed environmentCreates and adheres to documented test plansPerforms testing, reports and tracks development issues and modifies code as necessarySchedules versioned releases to maintain and update softwareDeploys software in the production environment, ensuring that it functions as expected,Monitor daily batch processing on a rotational schedule Provides Cross-training and Application SupportCross-trains peers with written documentation of code, schemas, test plans and operation instructionsResolve assigned help desk tickets for application issues Defines, analyzes and resolves programming errors and failures Functions as an IT subject matter expertProvides guidance and expert advice to management or other groups on technical, systems, or process-related topicsResearches and recommends compatible programs and plug-ins to augment in-house softwareAdministers assigned workSets specific goals and plans that prioritize, organize, and facilitate completion of each requested projectEstimates time, costs, resources, or materials needed to perform a work activityMaintains industry knowledge by attending educational workshops or classes; reviewing related publications; establishing networks. Contributes to team effort by accomplishing related results as needed, including special projects and tasks as delegated supervisor.Requirements:IT Programmer Education Requirements (R/Required, P/Preferred):(P) Associate degree, Trade or Technical School(P) Bachelor's Degree Degrees Preferred: Information Technology or related field IT Programmer Training, Skills, Knowledge and ExperienceSpecific Training in this field (R/Required, P/Preferred):(R) Demonstrated proficiency in 1 or more programming language(s) (R) Experience with databases(R) Experience with ERP systemsExperience/Knowledge in this field (R/Required, P/Preferred): (R) 5+ years of experience in similar position(P) Experience in Manufacturing industryGeneral Experiences/Knowledge/Skills: Positive attitude and desire to work as part of a team in fast-paced environmentSelf-motivated with a proven ability to solve complex problemsDemonstrate analytical thought process and excellent communication skills, both written and verbal.Demonstrate a strong attention to detail, focus and a willingness to work toward defined goalsMust be very flexible and supportive of changing requirementsDemonstrated ability to provide excellent customer service for internal and external customerExceptional time management skills with the ability to successfully work on multiple projects simultaneouslyPI236270576"
