job_url,site,title,company,company_url,location,job_type,date_posted,interval,min_amount,max_amount,currency,is_remote,num_urgent_words,benefits,emails,description
https://www.indeed.com/viewjob?jk=3cc94293a7ae23ea,indeed,Data Scientist,Louisiana State University,https://www.indeed.com/cmp/Louisiana-State-University,"Baton Rouge, LA, USA",fulltime,2022-10-21,yearly,65000.0,65000.0,USD,False,0.0,,"hr@lsu.edu, HR@lsu.edu","All Job Postings will close at 12:01a.m. CST (1:01a.m. EST) on the specified Closing Date (if designated). If you close the browser or exit your application prior to submitting, the application progress will be saved as a draft. You will be able to access and complete the application through “My Draft Applications” located on your Candidate Home page. Job Posting Title: Research Data Scientist (IT Analyst 3) Position Type: Professional / Unclassified Department: LSUAM ORED - CCT - Materials - Computational (Daijiang Li (00065506)) Work Location: 1079 Digital Media Center Pay Grade: Professional Job Description: Applications are invited for a Data Scientist position funded by an NSF grant in the Li lab (https://www.dlilab.com) in the Department of Biological Sciences and the Center of Computation & Technology at LSU. This position involves computational work and no field work. This project is collaborative, and the Data Scientist will have opportunities to work with researchers and data scientists from other institutions such as the University of Florida, iNaturalist, Chicago Botanical Garden, and University of Arizona. Job Responsibilities: Major duties of this position include developing machine learning methods to extract phenological information (e.g., presence/absence of leaf, flower, fruit) from images such as photographs uploaded to iNaturalist and digitized specimens; building software to integrate existing phenological records from different networks as well as the extracted phenological data into a central phenology database (PhenoBase); disseminating and maintaining PhenoBase through online web portal and R/Python packages, and developing and organizing workshops and tutorials to train users to use PhenoBase and the developed machine learning methods. (85%) Help with organizing project meetings, mentoring undergraduate and graduate students working on similar projects. (10%) Other duties as assigned (5%) Minimum Qualifications: Ph.D. in Mathematics, Statistics, Data Science, Computer Science, or other TEM field with strong data science and machine learning skills and interests in biology OR Ph.D. in Biology, Ecology, or other relevant discipline with strong data science skills. Strong software development skills (e.g., R, Python, C++), knowledge of databases, experience working with or developing OWL ontologies, and good oral and written communication skills. Physical Demands: Physical ability and eye-hand coordination necessary to use a computer terminal, copier, telephone and other standard office equipment; ability to sit in the same position for extended periods (5.5+ hours a day) at a time using continuous hand motions when entering data into the computer system. Additional Information: The preferred start date is January 2023 but can be slightly flexible. This position is fully funded for up to 30 months pending satisfactory performance with competitive salary (expectation $65,000/year). Our research group is committed to anti-racism and is diverse (https://www.dlilab.com/value/). Applicants from historically excluded groups are encouraged to apply. Additional Job Description: Special Instructions: Please attach ALL required documents under the ""Resume/CV"" section of your application. Please attach a cover letter, resume, and three professional references, including name, title, phone number, and e-mail address. A copy of your transcript(s) may be attached to your application (if available). However, original transcripts are required prior to hire. Posting Date: October 21, 2022 Closing Date (Open Until Filled if No Date Specified): Additional Position Information: Background Check - An offer of employment is contingent on a satisfactory pre-employment background check. Benefits - LSU offers outstanding benefits to eligible employees and their dependents including health, life, dental, and vision insurance; flexible spending accounts; retirement options; various leave options; paid holidays; wellness benefits; tuition exemption for qualified positions; training and development opportunities; employee discounts; and more! Essential Position (Y/N): LSU is an Equal Opportunity Employer: LSU believes diversity, equity, and inclusion enrich the educational experience of our students, faculty, and staff, and are necessary to prepare all people to thrive personally and professionally in a global society. We celebrate diversity and are committed to the principles of diversity and inclusion. We actively seek and encourage qualified applications from persons with diverse backgrounds, cultures and experiences. To learn more about how LSU is committed to diversity and inclusivity, please see LSU’s Diversity Statement and Roadmap . Persons needing accommodations or assistance with the accessibility of materials related to this search are encouraged to contact the Office of Human Resource Management ( hr@lsu.edu ). HCM Contact Information: Questions or concerns can be directed to the LSU Human Resources Management Office at 225-578-8200 or emailed HR@lsu.edu"
https://www.indeed.com/viewjob?jk=3cc94293a7ae23ea,indeed,Data Scientist,Louisiana State University,https://www.indeed.com/cmp/Louisiana-State-University,"Baton Rouge, LA, USA",fulltime,2022-10-21,yearly,65000.0,65000.0,USD,False,0.0,,"hr@lsu.edu, HR@lsu.edu","All Job Postings will close at 12:01a.m. CST (1:01a.m. EST) on the specified Closing Date (if designated). If you close the browser or exit your application prior to submitting, the application progress will be saved as a draft. You will be able to access and complete the application through “My Draft Applications” located on your Candidate Home page. Job Posting Title: Research Data Scientist (IT Analyst 3) Position Type: Professional / Unclassified Department: LSUAM ORED - CCT - Materials - Computational (Daijiang Li (00065506)) Work Location: 1079 Digital Media Center Pay Grade: Professional Job Description: Applications are invited for a Data Scientist position funded by an NSF grant in the Li lab (https://www.dlilab.com) in the Department of Biological Sciences and the Center of Computation & Technology at LSU. This position involves computational work and no field work. This project is collaborative, and the Data Scientist will have opportunities to work with researchers and data scientists from other institutions such as the University of Florida, iNaturalist, Chicago Botanical Garden, and University of Arizona. Job Responsibilities: Major duties of this position include developing machine learning methods to extract phenological information (e.g., presence/absence of leaf, flower, fruit) from images such as photographs uploaded to iNaturalist and digitized specimens; building software to integrate existing phenological records from different networks as well as the extracted phenological data into a central phenology database (PhenoBase); disseminating and maintaining PhenoBase through online web portal and R/Python packages, and developing and organizing workshops and tutorials to train users to use PhenoBase and the developed machine learning methods. (85%) Help with organizing project meetings, mentoring undergraduate and graduate students working on similar projects. (10%) Other duties as assigned (5%) Minimum Qualifications: Ph.D. in Mathematics, Statistics, Data Science, Computer Science, or other TEM field with strong data science and machine learning skills and interests in biology OR Ph.D. in Biology, Ecology, or other relevant discipline with strong data science skills. Strong software development skills (e.g., R, Python, C++), knowledge of databases, experience working with or developing OWL ontologies, and good oral and written communication skills. Physical Demands: Physical ability and eye-hand coordination necessary to use a computer terminal, copier, telephone and other standard office equipment; ability to sit in the same position for extended periods (5.5+ hours a day) at a time using continuous hand motions when entering data into the computer system. Additional Information: The preferred start date is January 2023 but can be slightly flexible. This position is fully funded for up to 30 months pending satisfactory performance with competitive salary (expectation $65,000/year). Our research group is committed to anti-racism and is diverse (https://www.dlilab.com/value/). Applicants from historically excluded groups are encouraged to apply. Additional Job Description: Special Instructions: Please attach ALL required documents under the ""Resume/CV"" section of your application. Please attach a cover letter, resume, and three professional references, including name, title, phone number, and e-mail address. A copy of your transcript(s) may be attached to your application (if available). However, original transcripts are required prior to hire. Posting Date: October 21, 2022 Closing Date (Open Until Filled if No Date Specified): Additional Position Information: Background Check - An offer of employment is contingent on a satisfactory pre-employment background check. Benefits - LSU offers outstanding benefits to eligible employees and their dependents including health, life, dental, and vision insurance; flexible spending accounts; retirement options; various leave options; paid holidays; wellness benefits; tuition exemption for qualified positions; training and development opportunities; employee discounts; and more! Essential Position (Y/N): LSU is an Equal Opportunity Employer: LSU believes diversity, equity, and inclusion enrich the educational experience of our students, faculty, and staff, and are necessary to prepare all people to thrive personally and professionally in a global society. We celebrate diversity and are committed to the principles of diversity and inclusion. We actively seek and encourage qualified applications from persons with diverse backgrounds, cultures and experiences. To learn more about how LSU is committed to diversity and inclusivity, please see LSU’s Diversity Statement and Roadmap . Persons needing accommodations or assistance with the accessibility of materials related to this search are encouraged to contact the Office of Human Resource Management ( hr@lsu.edu ). HCM Contact Information: Questions or concerns can be directed to the LSU Human Resources Management Office at 225-578-8200 or emailed HR@lsu.edu"
https://www.linkedin.com/jobs/view/3808425669,linkedin,"Analyst, Data Scientist",Cerberus Capital Management,https://www.linkedin.com/company/cerberus-capital-management,"New York, NY",,2024-01-17,,,,,,,Actively Hiring +8 benefits,,
https://www.linkedin.com/jobs/view/3818040320,linkedin,Data Science Analyst,Wingstop Restaurants Inc.,https://www.linkedin.com/company/wingstop-restaurants-inc-,"Dallas, TX",,2024-01-30,,,,,,,Actively Hiring,,
https://www.linkedin.com/jobs/view/3823235416,linkedin,Data Science Analyst,Wingstop Restaurants Inc.,https://www.linkedin.com/company/wingstop-restaurants-inc-,"Addison, TX",,2024-02-06,,,,,,,Actively Hiring,,
https://www.linkedin.com/jobs/view/3787333992,linkedin,Data Scientist,Lever Middleware Test Company 2,https://www.linkedin.com/company/lever-middleware-test-company-2,"San Diego, CA",,2023-12-15,,,,,,,Be an early applicant,,
https://www.linkedin.com/jobs/view/3825031346,linkedin,Jr. AI Program Analyst (100% Remote),Citizant,https://www.linkedin.com/company/citizant,"Chantilly, VA",,2024-02-05,,,,,,,Be an early applicant,,
https://www.linkedin.com/jobs/view/3731650860,linkedin,Machine Learning Consultant,Wise Skulls,https://www.linkedin.com/company/wearewiseskulls,"Austin, TX",,2023-10-03,,,,,,,Actively Hiring,,
https://www.linkedin.com/jobs/view/3818962571,linkedin,Data Science Analyst (Pandas),"Liberty Personnel Services, Inc.",https://www.linkedin.com/company/liberty-personnel-services-inc,"Philadelphia, PA",,2024-01-31,,,,,,,Actively Hiring,,
https://www.linkedin.com/jobs/view/3788460139,linkedin,"Data Scientists - AI Training (Remote Work, Contract)",Remotasks,https://www.linkedin.com/company/remotasks,,,2024-01-31,,,,,,,,,
https://www.linkedin.com/jobs/view/3823373330,linkedin,"Data Scientists - AI Training (Remote Work, Contract)",Outlier,https://www.linkedin.com/company/try-outlier,"San Francisco, CA",,2024-02-06,,,,,,,,,
https://www.linkedin.com/jobs/view/3821855012,linkedin,Junior/Entry Level Data Scientist/Analyst,SynergisticIT,https://www.linkedin.com/company/synergisticit,"Iowa City, IA",,2024-02-02,,,,,,,Be an early applicant,,
https://www.linkedin.com/jobs/view/3813110600,linkedin,Jr Data Scientist,Tech Consulting,https://www.linkedin.com/company/techconsultingusa,"Atlanta, GA",,,,,,,,,Actively Hiring +4 benefits,,
https://www.linkedin.com/jobs/view/3714181405,linkedin,Artificial Intelligence Developer (HYBRID),Serigor Inc,https://www.linkedin.com/company/serigor-inc,"Washington, DC",,2023-09-11,,,,,,,Actively Hiring,,
https://www.linkedin.com/jobs/view/3804252156,linkedin,"Associate, Machine Learning",Flagship Pioneering,https://www.linkedin.com/company/flagship-pioneering,"Cambridge, MA",,2024-02-02,,,,,,,,,
https://www.linkedin.com/jobs/view/3818363619,linkedin,Remote Data Scientist/Analyst (Entry/Junior Level),SynergisticIT,https://www.linkedin.com/company/synergisticit,"Washington, DC",,2024-02-05,,,,,,,Be an early applicant,,
https://www.linkedin.com/jobs/view/3820463326,linkedin,Data Scientist,RYVYL,https://www.linkedin.com/company/ryvyl,"San Diego, CA",,2024-02-08,,,,,,,Actively Hiring +4 benefits,,
https://www.linkedin.com/jobs/view/3787775578,linkedin,Targeting Analyst/Data Scientist,J5 Consulting,https://www.linkedin.com/company/j5consulting,"McLean, VA",,2023-12-16,,,,,,,Be an early applicant,,
https://www.linkedin.com/jobs/view/3572303790,linkedin,Mid-Level Data Scientist,"Technomics, Inc.",https://www.linkedin.com/company/technomics-inc-,"Arlington, VA",,2023-04-19,,,,,,,Actively Hiring,,
https://www.linkedin.com/jobs/view/3818359785,linkedin,Remote Data Scientist/Analyst (Entry/Junior Level),SynergisticIT,https://www.linkedin.com/company/synergisticit,"Bellevue, WA",,2024-02-05,,,,,,,Be an early applicant,,
https://www.linkedin.com/jobs/view/3702645103,linkedin,Artificial Intelligence Analyst,"Changing Technologies, Inc.",https://www.linkedin.com/company/changing-technologies-inc,"Washington, DC",,2023-08-28,,,,,,,,,
https://www.linkedin.com/jobs/view/3821852591,linkedin,Remote Data Scientist/Analyst (Entry/Junior Level),SynergisticIT,https://www.linkedin.com/company/synergisticit,"Huntington Beach, CA",,2024-02-02,,,,,,,Be an early applicant,,
https://www.linkedin.com/jobs/view/3799457828,linkedin,Data Scientist (Hybrid),Enova International,https://www.linkedin.com/company/enova-international,"Chicago, IL",,2024-01-27,,,,,,,,,
https://www.linkedin.com/jobs/view/3818361672,linkedin,Remote Data Scientist/Analyst (Entry/Junior Level),SynergisticIT,https://www.linkedin.com/company/synergisticit,"St Paul, MN",,2024-02-05,,,,,,,Be an early applicant,,
https://www.linkedin.com/jobs/view/3818366532,linkedin,Entry Level Data Analyst/Scientist - Remote,SynergisticIT,https://www.linkedin.com/company/synergisticit,,,2024-02-05,,,,,,,,,
https://www.linkedin.com/jobs/view/3816769407,linkedin,Data Scientist II (Product Analyst),Cedar,https://www.linkedin.com/company/cedar-inc.,"New York, NY",,2024-01-30,,,,,,,Actively Hiring,,
https://www.linkedin.com/jobs/view/3818359815,linkedin,Remote Data Scientist/Analyst (Entry/Junior Level),SynergisticIT,https://www.linkedin.com/company/synergisticit,"Washington, DC",,2024-02-05,,,,,,,Be an early applicant,,
https://www.linkedin.com/jobs/view/3820728616,linkedin,Remote Data Scientist/Analyst (Entry/Junior Level),SynergisticIT,https://www.linkedin.com/company/synergisticit,"Dallas, TX",,2024-02-02,,,,,,,Be an early applicant,,
https://www.linkedin.com/jobs/view/3818364531,linkedin,Junior Data Scientist/Analyst (Remote),SynergisticIT,https://www.linkedin.com/company/synergisticit,"Fremont, CA",,2024-02-05,,,,,,,Be an early applicant,,
https://www.linkedin.com/jobs/view/3818365610,linkedin,Remote Data Scientist/Analyst (Entry/Junior Level),SynergisticIT,https://www.linkedin.com/company/synergisticit,"Charleston, SC",,2024-02-05,,,,,,,Be an early applicant,,
https://www.linkedin.com/jobs/view/3745378186,linkedin,NLP Analyst/ Chatbot Developer,Adame Services LLC,https://www.linkedin.com/company/adameservices,"Dallas, TX",,2023-10-24,,,,,,,,,
https://www.linkedin.com/jobs/view/3821860148,linkedin,Entry Level Data Scientist/Analyst,SynergisticIT,https://www.linkedin.com/company/synergisticit,"Houston, TX",,2024-02-01,,,,,,,Be an early applicant,,
https://www.indeed.com/viewjob?jk=3cc94293a7ae23ea,indeed,Data Scientist,Louisiana State University,https://www.indeed.com/cmp/Louisiana-State-University,"Baton Rouge, LA, USA",fulltime,2022-10-21,yearly,65000.0,65000.0,USD,False,0.0,,"hr@lsu.edu, HR@lsu.edu","All Job Postings will close at 12:01a.m. CST (1:01a.m. EST) on the specified Closing Date (if designated). If you close the browser or exit your application prior to submitting, the application progress will be saved as a draft. You will be able to access and complete the application through “My Draft Applications” located on your Candidate Home page. Job Posting Title: Research Data Scientist (IT Analyst 3) Position Type: Professional / Unclassified Department: LSUAM ORED - CCT - Materials - Computational (Daijiang Li (00065506)) Work Location: 1079 Digital Media Center Pay Grade: Professional Job Description: Applications are invited for a Data Scientist position funded by an NSF grant in the Li lab (https://www.dlilab.com) in the Department of Biological Sciences and the Center of Computation & Technology at LSU. This position involves computational work and no field work. This project is collaborative, and the Data Scientist will have opportunities to work with researchers and data scientists from other institutions such as the University of Florida, iNaturalist, Chicago Botanical Garden, and University of Arizona. Job Responsibilities: Major duties of this position include developing machine learning methods to extract phenological information (e.g., presence/absence of leaf, flower, fruit) from images such as photographs uploaded to iNaturalist and digitized specimens; building software to integrate existing phenological records from different networks as well as the extracted phenological data into a central phenology database (PhenoBase); disseminating and maintaining PhenoBase through online web portal and R/Python packages, and developing and organizing workshops and tutorials to train users to use PhenoBase and the developed machine learning methods. (85%) Help with organizing project meetings, mentoring undergraduate and graduate students working on similar projects. (10%) Other duties as assigned (5%) Minimum Qualifications: Ph.D. in Mathematics, Statistics, Data Science, Computer Science, or other TEM field with strong data science and machine learning skills and interests in biology OR Ph.D. in Biology, Ecology, or other relevant discipline with strong data science skills. Strong software development skills (e.g., R, Python, C++), knowledge of databases, experience working with or developing OWL ontologies, and good oral and written communication skills. Physical Demands: Physical ability and eye-hand coordination necessary to use a computer terminal, copier, telephone and other standard office equipment; ability to sit in the same position for extended periods (5.5+ hours a day) at a time using continuous hand motions when entering data into the computer system. Additional Information: The preferred start date is January 2023 but can be slightly flexible. This position is fully funded for up to 30 months pending satisfactory performance with competitive salary (expectation $65,000/year). Our research group is committed to anti-racism and is diverse (https://www.dlilab.com/value/). Applicants from historically excluded groups are encouraged to apply. Additional Job Description: Special Instructions: Please attach ALL required documents under the ""Resume/CV"" section of your application. Please attach a cover letter, resume, and three professional references, including name, title, phone number, and e-mail address. A copy of your transcript(s) may be attached to your application (if available). However, original transcripts are required prior to hire. Posting Date: October 21, 2022 Closing Date (Open Until Filled if No Date Specified): Additional Position Information: Background Check - An offer of employment is contingent on a satisfactory pre-employment background check. Benefits - LSU offers outstanding benefits to eligible employees and their dependents including health, life, dental, and vision insurance; flexible spending accounts; retirement options; various leave options; paid holidays; wellness benefits; tuition exemption for qualified positions; training and development opportunities; employee discounts; and more! Essential Position (Y/N): LSU is an Equal Opportunity Employer: LSU believes diversity, equity, and inclusion enrich the educational experience of our students, faculty, and staff, and are necessary to prepare all people to thrive personally and professionally in a global society. We celebrate diversity and are committed to the principles of diversity and inclusion. We actively seek and encourage qualified applications from persons with diverse backgrounds, cultures and experiences. To learn more about how LSU is committed to diversity and inclusivity, please see LSU’s Diversity Statement and Roadmap . Persons needing accommodations or assistance with the accessibility of materials related to this search are encouraged to contact the Office of Human Resource Management ( hr@lsu.edu ). HCM Contact Information: Questions or concerns can be directed to the LSU Human Resources Management Office at 225-578-8200 or emailed HR@lsu.edu"
