job_url,site,title,company,company_url,location,job_type,date_posted,interval,min_amount,max_amount,currency,is_remote,num_urgent_words,benefits,emails,description
https://www.indeed.com/viewjob?jk=3cc94293a7ae23ea,indeed,Data Scientist,Louisiana State University,https://www.indeed.com/cmp/Louisiana-State-University,"Baton Rouge, LA, USA",fulltime,2022-10-21,yearly,65000.0,65000.0,USD,False,0.0,,"hr@lsu.edu, HR@lsu.edu","All Job Postings will close at 12:01a.m. CST (1:01a.m. EST) on the specified Closing Date (if designated). If you close the browser or exit your application prior to submitting, the application progress will be saved as a draft. You will be able to access and complete the application through “My Draft Applications” located on your Candidate Home page. Job Posting Title: Research Data Scientist (IT Analyst 3) Position Type: Professional / Unclassified Department: LSUAM ORED - CCT - Materials - Computational (Daijiang Li (00065506)) Work Location: 1079 Digital Media Center Pay Grade: Professional Job Description: Applications are invited for a Data Scientist position funded by an NSF grant in the Li lab (https://www.dlilab.com) in the Department of Biological Sciences and the Center of Computation & Technology at LSU. This position involves computational work and no field work. This project is collaborative, and the Data Scientist will have opportunities to work with researchers and data scientists from other institutions such as the University of Florida, iNaturalist, Chicago Botanical Garden, and University of Arizona. Job Responsibilities: Major duties of this position include developing machine learning methods to extract phenological information (e.g., presence/absence of leaf, flower, fruit) from images such as photographs uploaded to iNaturalist and digitized specimens; building software to integrate existing phenological records from different networks as well as the extracted phenological data into a central phenology database (PhenoBase); disseminating and maintaining PhenoBase through online web portal and R/Python packages, and developing and organizing workshops and tutorials to train users to use PhenoBase and the developed machine learning methods. (85%) Help with organizing project meetings, mentoring undergraduate and graduate students working on similar projects. (10%) Other duties as assigned (5%) Minimum Qualifications: Ph.D. in Mathematics, Statistics, Data Science, Computer Science, or other TEM field with strong data science and machine learning skills and interests in biology OR Ph.D. in Biology, Ecology, or other relevant discipline with strong data science skills. Strong software development skills (e.g., R, Python, C++), knowledge of databases, experience working with or developing OWL ontologies, and good oral and written communication skills. Physical Demands: Physical ability and eye-hand coordination necessary to use a computer terminal, copier, telephone and other standard office equipment; ability to sit in the same position for extended periods (5.5+ hours a day) at a time using continuous hand motions when entering data into the computer system. Additional Information: The preferred start date is January 2023 but can be slightly flexible. This position is fully funded for up to 30 months pending satisfactory performance with competitive salary (expectation $65,000/year). Our research group is committed to anti-racism and is diverse (https://www.dlilab.com/value/). Applicants from historically excluded groups are encouraged to apply. Additional Job Description: Special Instructions: Please attach ALL required documents under the ""Resume/CV"" section of your application. Please attach a cover letter, resume, and three professional references, including name, title, phone number, and e-mail address. A copy of your transcript(s) may be attached to your application (if available). However, original transcripts are required prior to hire. Posting Date: October 21, 2022 Closing Date (Open Until Filled if No Date Specified): Additional Position Information: Background Check - An offer of employment is contingent on a satisfactory pre-employment background check. Benefits - LSU offers outstanding benefits to eligible employees and their dependents including health, life, dental, and vision insurance; flexible spending accounts; retirement options; various leave options; paid holidays; wellness benefits; tuition exemption for qualified positions; training and development opportunities; employee discounts; and more! Essential Position (Y/N): LSU is an Equal Opportunity Employer: LSU believes diversity, equity, and inclusion enrich the educational experience of our students, faculty, and staff, and are necessary to prepare all people to thrive personally and professionally in a global society. We celebrate diversity and are committed to the principles of diversity and inclusion. We actively seek and encourage qualified applications from persons with diverse backgrounds, cultures and experiences. To learn more about how LSU is committed to diversity and inclusivity, please see LSU’s Diversity Statement and Roadmap . Persons needing accommodations or assistance with the accessibility of materials related to this search are encouraged to contact the Office of Human Resource Management ( hr@lsu.edu ). HCM Contact Information: Questions or concerns can be directed to the LSU Human Resources Management Office at 225-578-8200 or emailed HR@lsu.edu"
https://www.indeed.com/viewjob?jk=3cc94293a7ae23ea,indeed,Data Scientist,Louisiana State University,https://www.indeed.com/cmp/Louisiana-State-University,"Baton Rouge, LA, USA",fulltime,2022-10-21,yearly,65000.0,65000.0,USD,False,0.0,,"hr@lsu.edu, HR@lsu.edu","All Job Postings will close at 12:01a.m. CST (1:01a.m. EST) on the specified Closing Date (if designated). If you close the browser or exit your application prior to submitting, the application progress will be saved as a draft. You will be able to access and complete the application through “My Draft Applications” located on your Candidate Home page. Job Posting Title: Research Data Scientist (IT Analyst 3) Position Type: Professional / Unclassified Department: LSUAM ORED - CCT - Materials - Computational (Daijiang Li (00065506)) Work Location: 1079 Digital Media Center Pay Grade: Professional Job Description: Applications are invited for a Data Scientist position funded by an NSF grant in the Li lab (https://www.dlilab.com) in the Department of Biological Sciences and the Center of Computation & Technology at LSU. This position involves computational work and no field work. This project is collaborative, and the Data Scientist will have opportunities to work with researchers and data scientists from other institutions such as the University of Florida, iNaturalist, Chicago Botanical Garden, and University of Arizona. Job Responsibilities: Major duties of this position include developing machine learning methods to extract phenological information (e.g., presence/absence of leaf, flower, fruit) from images such as photographs uploaded to iNaturalist and digitized specimens; building software to integrate existing phenological records from different networks as well as the extracted phenological data into a central phenology database (PhenoBase); disseminating and maintaining PhenoBase through online web portal and R/Python packages, and developing and organizing workshops and tutorials to train users to use PhenoBase and the developed machine learning methods. (85%) Help with organizing project meetings, mentoring undergraduate and graduate students working on similar projects. (10%) Other duties as assigned (5%) Minimum Qualifications: Ph.D. in Mathematics, Statistics, Data Science, Computer Science, or other TEM field with strong data science and machine learning skills and interests in biology OR Ph.D. in Biology, Ecology, or other relevant discipline with strong data science skills. Strong software development skills (e.g., R, Python, C++), knowledge of databases, experience working with or developing OWL ontologies, and good oral and written communication skills. Physical Demands: Physical ability and eye-hand coordination necessary to use a computer terminal, copier, telephone and other standard office equipment; ability to sit in the same position for extended periods (5.5+ hours a day) at a time using continuous hand motions when entering data into the computer system. Additional Information: The preferred start date is January 2023 but can be slightly flexible. This position is fully funded for up to 30 months pending satisfactory performance with competitive salary (expectation $65,000/year). Our research group is committed to anti-racism and is diverse (https://www.dlilab.com/value/). Applicants from historically excluded groups are encouraged to apply. Additional Job Description: Special Instructions: Please attach ALL required documents under the ""Resume/CV"" section of your application. Please attach a cover letter, resume, and three professional references, including name, title, phone number, and e-mail address. A copy of your transcript(s) may be attached to your application (if available). However, original transcripts are required prior to hire. Posting Date: October 21, 2022 Closing Date (Open Until Filled if No Date Specified): Additional Position Information: Background Check - An offer of employment is contingent on a satisfactory pre-employment background check. Benefits - LSU offers outstanding benefits to eligible employees and their dependents including health, life, dental, and vision insurance; flexible spending accounts; retirement options; various leave options; paid holidays; wellness benefits; tuition exemption for qualified positions; training and development opportunities; employee discounts; and more! Essential Position (Y/N): LSU is an Equal Opportunity Employer: LSU believes diversity, equity, and inclusion enrich the educational experience of our students, faculty, and staff, and are necessary to prepare all people to thrive personally and professionally in a global society. We celebrate diversity and are committed to the principles of diversity and inclusion. We actively seek and encourage qualified applications from persons with diverse backgrounds, cultures and experiences. To learn more about how LSU is committed to diversity and inclusivity, please see LSU’s Diversity Statement and Roadmap . Persons needing accommodations or assistance with the accessibility of materials related to this search are encouraged to contact the Office of Human Resource Management ( hr@lsu.edu ). HCM Contact Information: Questions or concerns can be directed to the LSU Human Resources Management Office at 225-578-8200 or emailed HR@lsu.edu"
https://www.indeed.com/viewjob?jk=3cc94293a7ae23ea,indeed,Data Scientist,Louisiana State University,https://www.indeed.com/cmp/Louisiana-State-University,"Baton Rouge, LA, USA",fulltime,2022-10-21,yearly,65000.0,65000.0,USD,False,0.0,,"hr@lsu.edu, HR@lsu.edu","All Job Postings will close at 12:01a.m. CST (1:01a.m. EST) on the specified Closing Date (if designated). If you close the browser or exit your application prior to submitting, the application progress will be saved as a draft. You will be able to access and complete the application through “My Draft Applications” located on your Candidate Home page. Job Posting Title: Research Data Scientist (IT Analyst 3) Position Type: Professional / Unclassified Department: LSUAM ORED - CCT - Materials - Computational (Daijiang Li (00065506)) Work Location: 1079 Digital Media Center Pay Grade: Professional Job Description: Applications are invited for a Data Scientist position funded by an NSF grant in the Li lab (https://www.dlilab.com) in the Department of Biological Sciences and the Center of Computation & Technology at LSU. This position involves computational work and no field work. This project is collaborative, and the Data Scientist will have opportunities to work with researchers and data scientists from other institutions such as the University of Florida, iNaturalist, Chicago Botanical Garden, and University of Arizona. Job Responsibilities: Major duties of this position include developing machine learning methods to extract phenological information (e.g., presence/absence of leaf, flower, fruit) from images such as photographs uploaded to iNaturalist and digitized specimens; building software to integrate existing phenological records from different networks as well as the extracted phenological data into a central phenology database (PhenoBase); disseminating and maintaining PhenoBase through online web portal and R/Python packages, and developing and organizing workshops and tutorials to train users to use PhenoBase and the developed machine learning methods. (85%) Help with organizing project meetings, mentoring undergraduate and graduate students working on similar projects. (10%) Other duties as assigned (5%) Minimum Qualifications: Ph.D. in Mathematics, Statistics, Data Science, Computer Science, or other TEM field with strong data science and machine learning skills and interests in biology OR Ph.D. in Biology, Ecology, or other relevant discipline with strong data science skills. Strong software development skills (e.g., R, Python, C++), knowledge of databases, experience working with or developing OWL ontologies, and good oral and written communication skills. Physical Demands: Physical ability and eye-hand coordination necessary to use a computer terminal, copier, telephone and other standard office equipment; ability to sit in the same position for extended periods (5.5+ hours a day) at a time using continuous hand motions when entering data into the computer system. Additional Information: The preferred start date is January 2023 but can be slightly flexible. This position is fully funded for up to 30 months pending satisfactory performance with competitive salary (expectation $65,000/year). Our research group is committed to anti-racism and is diverse (https://www.dlilab.com/value/). Applicants from historically excluded groups are encouraged to apply. Additional Job Description: Special Instructions: Please attach ALL required documents under the ""Resume/CV"" section of your application. Please attach a cover letter, resume, and three professional references, including name, title, phone number, and e-mail address. A copy of your transcript(s) may be attached to your application (if available). However, original transcripts are required prior to hire. Posting Date: October 21, 2022 Closing Date (Open Until Filled if No Date Specified): Additional Position Information: Background Check - An offer of employment is contingent on a satisfactory pre-employment background check. Benefits - LSU offers outstanding benefits to eligible employees and their dependents including health, life, dental, and vision insurance; flexible spending accounts; retirement options; various leave options; paid holidays; wellness benefits; tuition exemption for qualified positions; training and development opportunities; employee discounts; and more! Essential Position (Y/N): LSU is an Equal Opportunity Employer: LSU believes diversity, equity, and inclusion enrich the educational experience of our students, faculty, and staff, and are necessary to prepare all people to thrive personally and professionally in a global society. We celebrate diversity and are committed to the principles of diversity and inclusion. We actively seek and encourage qualified applications from persons with diverse backgrounds, cultures and experiences. To learn more about how LSU is committed to diversity and inclusivity, please see LSU’s Diversity Statement and Roadmap . Persons needing accommodations or assistance with the accessibility of materials related to this search are encouraged to contact the Office of Human Resource Management ( hr@lsu.edu ). HCM Contact Information: Questions or concerns can be directed to the LSU Human Resources Management Office at 225-578-8200 or emailed HR@lsu.edu"
https://www.linkedin.com/jobs/view/3814767167,linkedin,Data Analyst,Optomi,https://www.linkedin.com/company/optomi,"Owings Mills, MD",,2024-02-01,,,,,,,Actively Hiring,,
https://www.linkedin.com/jobs/view/3823517942,linkedin,"Data Scientist, gt.school (Remote) - $60,000/year USD",Crossover,https://www.linkedin.com/company/crossover,"Washington, DC",,2024-02-09,,30.0,30.0,USD,,,Be an early applicant,,
https://www.linkedin.com/jobs/view/3821039903,linkedin,Lead Data Science Analyst (multiple openings) - IHM,Discover Financial Services,https://www.linkedin.com/company/discover-financial-services,"Riverwoods, IL",,2024-02-08,,,,,,,Actively Hiring,,
https://www.linkedin.com/jobs/view/3813071716,linkedin,Senior Data Analyst,Dexian,https://www.linkedin.com/company/dexiansolutions,"Irving, TX",,2024-01-29,,,,,,,Actively Hiring +4 benefits,,
https://www.linkedin.com/jobs/view/3771894975,linkedin,Business Development Associate,Probably Genetic,https://www.linkedin.com/company/probablygenetic,"San Francisco, CA",,2023-11-23,,,,,,,,,
https://www.linkedin.com/jobs/view/3803206391,linkedin,"Senior Risk Analyst, Loss Forecasting",SoFi,https://www.linkedin.com/company/sofi,"Iowa, IA",,2024-02-01,,99200.0,186000.0,USD,,,Actively Hiring,,
https://www.linkedin.com/jobs/view/3823523202,linkedin,"Data Scientist, gt.school (Remote) - $60,000/year USD",Crossover,https://www.linkedin.com/company/crossover,"Round Rock, TX",,2024-02-09,,30.0,30.0,USD,,,Be an early applicant,,
https://www.linkedin.com/jobs/view/3787340114,linkedin,"Engineer II, Mechanical",Lever Middleware Test Company 2,https://www.linkedin.com/company/lever-middleware-test-company-2,"Ann Arbor, MI",,2023-12-15,,,,,,,Be an early applicant,,
https://www.linkedin.com/jobs/view/3800496207,linkedin,"Senior Analyst, Data Science",American Chemical Society,https://www.linkedin.com/company/american-chemical-society,"Washington, DC",,2024-01-09,,,,,,,,,
https://www.linkedin.com/jobs/view/3797969946,linkedin,Senior Clinical Data Analyst,Modern Health,https://www.linkedin.com/company/modern-health,"Atlanta, GA",,2024-01-03,,,,,,,,,
https://www.linkedin.com/jobs/view/3822114520,linkedin,Data Analyst I,KYYBA Inc,https://www.linkedin.com/company/kyyba-inc,"North Chicago, IL",,2024-02-09,,,,,,,Actively Hiring,,
https://www.linkedin.com/jobs/view/3815115715,linkedin,Staff Analyst - Expert Planning and Analytics,Intuit,https://www.linkedin.com/company/intuit,"San Diego, CA",,2024-01-25,,,,,,,Be an early applicant,,
https://www.linkedin.com/jobs/view/3786854826,linkedin,Senior Revenue Data Analyst,DoorDash,https://www.linkedin.com/company/doordash,"Miami, FL",,2024-01-26,,,,,,,Actively Hiring,,
https://www.linkedin.com/jobs/view/3777015234,linkedin,Psyche Magnetometer Data Analyst I,Massachusetts Institute of Technology,https://www.linkedin.com/company/mit,"Cambridge, MA",,2023-12-08,,,,,,,Be an early applicant,,
https://www.linkedin.com/jobs/view/3823521283,linkedin,"Data Scientist, gt.school (Remote) - $60,000/year USD",Crossover,https://www.linkedin.com/company/crossover,"Centennial, CO",,,,30.0,30.0,USD,,,Be an early applicant,,
https://www.linkedin.com/jobs/view/3822644103,linkedin,Data Analyst,Deloitte,https://www.linkedin.com/company/deloitte,"Arlington, VA",,2024-02-10,,,,,,,Actively Hiring,,
https://www.linkedin.com/jobs/view/3797049973,linkedin,Bioinformatics Analyst III - Laboratory of Dr. Kuo-Fen Lee,Salk Institute for Biological Studies,https://www.linkedin.com/company/salk-institute-for-biological-studies,,,2024-01-30,,,,,,,Actively Hiring,,
https://www.linkedin.com/jobs/view/3823392005,linkedin,Junior data analyst/ Programmer,SynergisticIT,https://www.linkedin.com/company/synergisticit,"Jersey City, NJ",,2024-02-07,,,,,,,,,
https://www.linkedin.com/jobs/view/3822660990,linkedin,Applied AI ML Senior Associate,JPMorgan Chase & Co.,https://www.linkedin.com/company/jpmorganchase,"Chicago, IL",,2024-02-11,,,,,,,Actively Hiring,,
https://www.linkedin.com/jobs/view/3778576478,linkedin,Sr. IQVIA Data Analyst,EPM Scientific,https://uk.linkedin.com/company/epm-scientific,"Westchester County, NY",,2024-01-31,,,,,,,Actively Hiring,,
https://www.linkedin.com/jobs/view/3821212457,linkedin,Business Analyst,TEKsystems,https://www.linkedin.com/company/teksystems,"New York, NY",,2024-02-03,,,,,,,Be an early applicant,,
https://www.linkedin.com/jobs/view/3810802726,linkedin,Trading Analyst - Remote,Chainsage,https://www.linkedin.com/company/chainsage,,,2024-01-20,,,,,,,Be an early applicant,,
https://www.linkedin.com/jobs/view/3821058342,linkedin,Research/Data Analyst Senior,"Datasoft Technologies, Inc.",https://www.linkedin.com/company/datasoft-technologies,"Atlanta, GA",,2024-02-05,,,,,,,Actively Hiring,,
https://www.linkedin.com/jobs/view/3766151893,linkedin,Vision Imaging Engineer Intern,Intuitive,https://www.linkedin.com/company/intuitivesurgical,"Sunnyvale, CA",,2024-02-03,,109500.0,144900.0,USD,,,Actively Hiring,,
https://www.linkedin.com/jobs/view/3726854824,linkedin,"Senior Data Analyst, Strategy & Operations",Attentive,https://www.linkedin.com/company/attentivehq,,,2024-02-01,,,,,,,Actively Hiring,,
